{
  "$schema": "https://json-schema.org/draft/2020-12/schema",
  "$id": "https://avrcade.local/vrclient/gta-san-andreas-native.schema.json",
  "title": "VRClient GTA San Andreas Native Hook Profile",
  "type": "object",
  "additionalProperties": false,
  "required": [
    "$schema", "schema", "game_sha256", "image_size", "image_base",
    "camera_address", "camera_matrix_offset", "fov_address", "aspect_ratio_address",
    "copy_camera_matrix_to_rw_cam",
    "rw_camera_offset", "set_rw_view_window", "set_rw_view_offset",
    "screen_dimensions", "derive_camera", "front_end_menu_active", "fade_status",
    "cutscene_running", "cutscene_processing",
    "pad_update_call", "frontend_pad_update_call", "player_pad", "pad_update_call_expected",
    "frontend_pad_update_call_expected",
    "find_player_ped", "set_player_heading", "find_player_vehicle", "get_bone_position",
    "ped_pre_render", "get_anim_hierarchy_from_clump",
    "rp_hanim_id_get_index", "rp_hanim_get_matrix_array",
    "hud_player_info", "hud_wanted", "hud_radar", "hud_vital_stats", "font_print_string",
    "render_tail", "render_tail_return", "camera_size",
    "d3d9_delay_thunk", "d3d9_delay_thunk_expected", "create_device_expected",
    "find_player_ped_expected", "set_player_heading_expected", "find_player_vehicle_expected", "get_bone_position_expected",
    "ped_pre_render_expected", "get_anim_hierarchy_from_clump_expected",
    "rp_hanim_id_get_index_expected", "rp_hanim_get_matrix_array_expected",
    "hud_player_info_expected", "hud_wanted_expected", "hud_radar_expected",
    "hud_vital_stats_expected", "font_print_string_expected",
    "render_tail_expected", "render_tail_return_expected", "camera_size_expected"
  ],
  "properties": {
    "$schema": { "type": "string", "minLength": 1 },
    "schema": { "const": "gta-san-andreas-native/1" },
    "game_sha256": { "type": "string", "pattern": "^[A-Fa-f0-9]{64}$" },
    "image_size": { "type": "integer", "minimum": 1 },
    "image_base": { "type": "string", "pattern": "^0x[0-9A-Fa-f]+$" },
    "camera_address": { "type": "string", "pattern": "^0x[0-9A-Fa-f]+$" },
    "camera_matrix_offset": { "type": "string", "pattern": "^0x[0-9A-Fa-f]+$" },
    "fov_address": { "type": "string", "pattern": "^0x[0-9A-Fa-f]+$" },
    "aspect_ratio_address": { "type": "string", "pattern": "^0x[0-9A-Fa-f]+$" },
    "copy_camera_matrix_to_rw_cam": { "type": "string", "pattern": "^0x[0-9A-Fa-f]+$" },
    "rw_camera_offset": { "type": "string", "pattern": "^0x[0-9A-Fa-f]+$" },
    "set_rw_view_window": { "type": "string", "pattern": "^0x[0-9A-Fa-f]+$" },
    "set_rw_view_offset": { "type": "string", "pattern": "^0x[0-9A-Fa-f]+$" },
    "screen_dimensions": { "type": "string", "pattern": "^0x[0-9A-Fa-f]+$" },
    "derive_camera": { "type": "string", "pattern": "^0x[0-9A-Fa-f]+$" },
    "front_end_menu_active": { "type": "string", "pattern": "^0x[0-9A-Fa-f]+$" },
    "fade_status": { "type": "string", "pattern": "^0x[0-9A-Fa-f]+$" },
    "cutscene_running": { "type": "string", "pattern": "^0x[0-9A-Fa-f]+$" },
    "cutscene_processing": { "type": "string", "pattern": "^0x[0-9A-Fa-f]+$" },
    "pad_update_call": { "type": "string", "pattern": "^0x[0-9A-Fa-f]+$" },
    "frontend_pad_update_call": { "type": "string", "pattern": "^0x[0-9A-Fa-f]+$" },
    "player_pad": { "type": "string", "pattern": "^0x[0-9A-Fa-f]+$" },
    "find_player_ped": { "type": "string", "pattern": "^0x[0-9A-Fa-f]+$" },
    "set_player_heading": { "type": "string", "pattern": "^0x[0-9A-Fa-f]+$" },
    "find_player_vehicle": { "type": "string", "pattern": "^0x[0-9A-Fa-f]+$" },
    "get_bone_position": { "type": "string", "pattern": "^0x[0-9A-Fa-f]+$" },
    "ped_pre_render": { "type": "string", "pattern": "^0x[0-9A-Fa-f]+$" },
    "get_anim_hierarchy_from_clump": { "type": "string", "pattern": "^0x[0-9A-Fa-f]+$" },
    "rp_hanim_id_get_index": { "type": "string", "pattern": "^0x[0-9A-Fa-f]+$" },
    "rp_hanim_get_matrix_array": { "type": "string", "pattern": "^0x[0-9A-Fa-f]+$" },
    "hud_player_info": { "type": "string", "pattern": "^0x[0-9A-Fa-f]+$" },
    "hud_wanted": { "type": "string", "pattern": "^0x[0-9A-Fa-f]+$" },
    "hud_radar": { "type": "string", "pattern": "^0x[0-9A-Fa-f]+$" },
    "hud_vital_stats": { "type": "string", "pattern": "^0x[0-9A-Fa-f]+$" },
    "font_print_string": { "type": "string", "pattern": "^0x[0-9A-Fa-f]+$" },
    "render_tail": { "type": "string", "pattern": "^0x[0-9A-Fa-f]+$" },
    "render_tail_return": { "type": "string", "pattern": "^0x[0-9A-Fa-f]+$" },
    "camera_size": { "type": "string", "pattern": "^0x[0-9A-Fa-f]+$" },
    "d3d9_delay_thunk": { "type": "string", "pattern": "^0x[0-9A-Fa-f]+$" },
    "d3d9_delay_thunk_expected": { "type": "string", "pattern": "^[0-9A-Fa-f]{2}( [0-9A-Fa-f]{2})+$" },
    "create_device_expected": { "type": "string", "pattern": "^[0-9A-Fa-f]{2}( [0-9A-Fa-f]{2})+$" },
    "pad_update_call_expected": { "type": "string", "pattern": "^[0-9A-Fa-f]{2}( [0-9A-Fa-f]{2})+$" },
    "frontend_pad_update_call_expected": { "type": "string", "pattern": "^[0-9A-Fa-f]{2}( [0-9A-Fa-f]{2})+$" },
    "find_player_ped_expected": { "type": "string", "pattern": "^[0-9A-Fa-f]{2}( [0-9A-Fa-f]{2})+$" },
    "set_player_heading_expected": { "type": "string", "pattern": "^[0-9A-Fa-f]{2}( [0-9A-Fa-f]{2})+$" },
    "find_player_vehicle_expected": { "type": "string", "pattern": "^[0-9A-Fa-f]{2}( [0-9A-Fa-f]{2})+$" },
    "get_bone_position_expected": { "type": "string", "pattern": "^[0-9A-Fa-f]{2}( [0-9A-Fa-f]{2})+$" },
    "ped_pre_render_expected": { "type": "string", "pattern": "^[0-9A-Fa-f]{2}( [0-9A-Fa-f]{2})+$" },
    "get_anim_hierarchy_from_clump_expected": { "type": "string", "pattern": "^[0-9A-Fa-f]{2}( [0-9A-Fa-f]{2})+$" },
    "rp_hanim_id_get_index_expected": { "type": "string", "pattern": "^[0-9A-Fa-f]{2}( [0-9A-Fa-f]{2})+$" },
    "rp_hanim_get_matrix_array_expected": { "type": "string", "pattern": "^[0-9A-Fa-f]{2}( [0-9A-Fa-f]{2})+$" },
    "hud_player_info_expected": { "type": "string", "pattern": "^[0-9A-Fa-f]{2}( [0-9A-Fa-f]{2})+$" },
    "hud_wanted_expected": { "type": "string", "pattern": "^[0-9A-Fa-f]{2}( [0-9A-Fa-f]{2})+$" },
    "hud_radar_expected": { "type": "string", "pattern": "^[0-9A-Fa-f]{2}( [0-9A-Fa-f]{2})+$" },
    "hud_vital_stats_expected": { "type": "string", "pattern": "^[0-9A-Fa-f]{2}( [0-9A-Fa-f]{2})+$" },
    "font_print_string_expected": { "type": "string", "pattern": "^[0-9A-Fa-f]{2}( [0-9A-Fa-f]{2})+$" },
    "render_tail_expected": { "type": "string", "pattern": "^[0-9A-Fa-f]{2}( [0-9A-Fa-f]{2})+$" },
    "render_tail_return_expected": { "type": "string", "pattern": "^[0-9A-Fa-f]{2}( [0-9A-Fa-f]{2})+$" },
    "camera_size_expected": { "type": "string", "pattern": "^[0-9A-Fa-f]{2}( [0-9A-Fa-f]{2})+$" }
  }
}
