{
  "$schema": "../schemas/gta-san-andreas-native.schema.json",
  "schema": "gta-san-andreas-native/1",
  "game_sha256": "a559aa772fd136379155efa71f00c47aad34bbfeae6196b0fe1047d0645cbd26",
  "image_size": 14383616,
  "image_base": "0x400000",
  "camera_address": "0xB6F028",
  "camera_matrix_offset": "0x974",
  "fov_address": "0x8D5038",
  "aspect_ratio_address": "0xC3EFA4",
  "copy_camera_matrix_to_rw_cam": "0x50AFA0",
  "rw_camera_offset": "0x954",
  "set_rw_view_window": "0x7EE410",
  "set_rw_view_offset": "0x7EE1A0",
  "screen_dimensions": "0xC17044",
  "derive_camera": "0x5150E0",
  "front_end_menu_active": "0xBA67A4",
  "fade_status": "0x50AE20",
  "cutscene_running": "0xB5F851",
  "cutscene_processing": "0xB5F852",
  "pad_update_call": "0x53BEE6",
  "frontend_pad_update_call": "0x53E78B",
  "player_pad": "0xB73458",
  "find_player_ped": "0x56E210",
  "set_player_heading": "0x43E0C0",
  "find_player_vehicle": "0x56E0D0",
  "get_bone_position": "0x5E4280",
  "ped_pre_render": "0x5E8A20",
  "get_anim_hierarchy_from_clump": "0x734B10",
  "rp_hanim_id_get_index": "0x7C51A0",
  "rp_hanim_get_matrix_array": "0x7C5120",
  "hud_player_info": "0x58EAF0",
  "hud_wanted": "0x58D9A0",
  "hud_radar": "0x58A330",
  "hud_vital_stats": "0x589650",
  "font_print_string": "0x71A700",
  "render_tail": "0x53E9AC",
  "render_tail_return": "0x53EC09",
  "camera_size": "0x72FC70",
  "d3d9_delay_thunk": "0x00807C10",
  "d3d9_delay_thunk_expected": "B8 D4 3E 8E 00",
  "create_device_expected": "8B FF 55 8B EC 81 EC F8 01 00 00",
  "pad_update_call_expected": "E8 E5 5E 00 00",
  "frontend_pad_update_call_expected": "E8 40 36 00 00",
  "find_player_ped_expected": "8B 44 24 04 85 C0 7D 07 0F B6 05 74 CD B7 00",
  "set_player_heading_expected": "8B C1 8B 48 14 85 C9 74 05 E9 52 CF 15 00",
  "find_player_vehicle_expected": "8B 44 24 04 85 C0 7D 07 0F B6 05 74 CD B7 00",
  "get_bone_position_expected": "8A 44 24 0C 83 EC 0C 56 8B F1 84 C0 8B 86 74 04 00 00",
  "ped_pre_render_expected": "83 B9 30 05 00 00 32",
  "get_anim_hierarchy_from_clump_expected": "8B 44 24 04 8B 48 04 89 4C 24 04 E9 90 FF FF FF",
  "rp_hanim_id_get_index_expected": "8B 54 24 04 56 83 C8 FF 8B 72 10 8B 52 04 33 C9",
  "rp_hanim_get_matrix_array_expected": "8B 44 24 04 8B 40 08 C3",
  "hud_player_info_expected": "81 EC A0 01 00 00",
  "hud_wanted_expected": "83 EC 4C 53 55",
  "hud_radar_expected": "A1 CC A7 96 00",
  "hud_vital_stats_expected": "A0 88 30 A4 00",
  "font_print_string_expected": "83 EC 10 53 8B 5C 24 20",
  "render_tail_expected": "A0 A4 67 BA 00",
  "render_tail_return_expected": "83 C4 08 C3",
  "camera_size_expected": "83 EC 34 57 8B 7C 24 3C"
}
